<?xml version="1.0" encoding="UTF-8"?>

<listacursos xmlns:xsi="http://www.w3.org/2001/XMLSchema-instance"
 xsi:noNamespaceSchemaLocation="Ejercicio1_Curso.xsd">
    <cursos curso="2DAM">
        <alumnos>
            <dni>333333R</dni>
            <nombre>Juan</nombre>
            <apellido>Garcia</apellido>
            <apellido>Garcia</apellido>
            <asignaturas codigo="c1">
                <nombre>Programacion</nombre>
                <horas>6</horas>
                <profesor>
                    <nrp>33</nrp>
                    <nombre>David</nombre>
                    <apellido>Pimentel</apellido>
                </profesor>
            </asignaturas>
        </alumnos>
        <alumnos>
            <dni>333333E</dni>
            <nombre>Pepe</nombre>
            <apellido>Viyuela</apellido>
            <asignaturas codigo="c2">
                <nombre>Lenguaje de marcas</nombre>
                <horas>6</horas>
                <profesor>
                    <nrp>24</nrp>
                    <nombre>Leandro</nombre>
                    <apellido>Morales</apellido>
                    <apellido>Vilchez</apellido>
                </profesor>
            </asignaturas>
        </alumnos>
    </cursos>

        
    <cursos curso="1DAM">
        <alumnos>
            <dni>333333A</dni>
            <nombre>Ronaldo</nombre>
            <apellido>Nazario</apellido>
            
            <asignaturas codigo="c3">
                <nombre>Bases de datos</nombre>
                <horas>6</horas>
                <profesor>
                    <nrp>12</nrp>
                    <nombre>Alejandro</nombre>
                    <apellido>Romero</apellido>
                </profesor>
            </asignaturas>

            <asignaturas codigo="c4">
                <nombre>Entornos de desarrollo</nombre>
                <horas>6</horas>
                <profesor>
                    <nrp>12</nrp>
                    <nombre>Alejandro</nombre>
                    <apellido>Romero</apellido>
                </profesor>
            </asignaturas>
        </alumnos>
    </cursos>
</listacursos>